{
  "$schema": "https://json-schema.org/draft/2020-12/schema",
  "$id": "https://raw.githubusercontent.com/adaliontech/Zaibatsu/v1.2.0/schemas/module-catalog.schema.json",
  "title": "Zaibatsu reusable module catalog",
  "type": "object",
  "additionalProperties": false,
  "required": ["contract_schema", "schema_version", "module_api_version", "modules"],
  "properties": {
    "contract_schema": {"const": "https://raw.githubusercontent.com/adaliontech/Zaibatsu/v1.2.0/schemas/module-catalog.schema.json"},
    "schema_version": {"const": "zaibatsu.module-catalog.v1"},
    "module_api_version": {"const": "zaibatsu.module.v1"},
    "modules": {
      "type": "array",
      "minItems": 9,
      "items": {
        "type": "object",
        "additionalProperties": false,
        "required": ["id", "slot", "interface_version", "kind", "implementation_status", "side_effect_authority", "policy_value", "description", "rebuild_boundary", "requires_slots", "provides"],
        "properties": {
          "id": {"type": "string", "pattern": "^[a-z0-9]+(?:-[a-z0-9]+)*$"},
          "slot": {"enum": ["source_versioning", "static_secrets", "runtime_secrets", "host_reproduction", "worker_environment", "scheduling", "execution", "verification", "feedback"]},
          "interface_version": {"const": "zaibatsu.module.v1"},
          "kind": {"enum": ["deterministic", "probabilistic_adapter"]},
          "implementation_status": {"enum": ["contract_only", "source_only", "planned"]},
          "side_effect_authority": {"const": false},
          "policy_value": {
            "oneOf": [
              {"type": "string", "minLength": 1},
              {"type": "array", "minItems": 1, "uniqueItems": true, "items": {"type": "string", "minLength": 1}}
            ]
          },
          "description": {"type": "string", "minLength": 1},
          "rebuild_boundary": {"type": "string", "minLength": 1},
          "requires_slots": {"type": "array", "uniqueItems": true, "items": {"type": "string"}},
          "provides": {"type": "array", "minItems": 1, "uniqueItems": true, "items": {"type": "string", "minLength": 1}}
        }
      }
    }
  }
}
