{
  "contract_schema": "https://raw.githubusercontent.com/adaliontech/Zaibatsu/v1.2.0/schemas/module-catalog.schema.json",
  "schema_version": "zaibatsu.module-catalog.v1",
  "module_api_version": "zaibatsu.module.v1",
  "modules": [
    {
      "id": "git-source",
      "slot": "source_versioning",
      "interface_version": "zaibatsu.module.v1",
      "kind": "deterministic",
      "implementation_status": "contract_only",
      "side_effect_authority": false,
      "policy_value": "git",
      "description": "Bind reviewed source and intended state to Git lineage",
      "rebuild_boundary": "source_and_intended_state",
      "requires_slots": [],
      "provides": ["versioned_source_ref", "reviewed_diff", "release_lineage"]
    },
    {
      "id": "sops-age-static-secrets",
      "slot": "static_secrets",
      "interface_version": "zaibatsu.module.v1",
      "kind": "deterministic",
      "implementation_status": "contract_only",
      "side_effect_authority": false,
      "policy_value": "sops_age",
      "description": "Describe encrypted static-secret material without plaintext values",
      "rebuild_boundary": "encrypted_bootstrap_material",
      "requires_slots": ["source_versioning"],
      "provides": ["ciphertext_manifest", "recipient_policy"]
    },
    {
      "id": "bounded-runtime-secrets",
      "slot": "runtime_secrets",
      "interface_version": "zaibatsu.module.v1",
      "kind": "deterministic",
      "implementation_status": "contract_only",
      "side_effect_authority": false,
      "policy_value": "bounded_secret_manager",
      "description": "Describe factory-scoped runtime secret delivery without embedding values",
      "rebuild_boundary": "runtime_identity_and_scope",
      "requires_slots": ["source_versioning"],
      "provides": ["secret_scope_contract", "machine_identity_contract"]
    },
    {
      "id": "ansible-host-reproduction",
      "slot": "host_reproduction",
      "interface_version": "zaibatsu.module.v1",
      "kind": "deterministic",
      "implementation_status": "contract_only",
      "side_effect_authority": false,
      "policy_value": "ansible",
      "description": "Bind host configuration to reviewed Ansible artifacts and evidence",
      "rebuild_boundary": "host_configuration",
      "requires_slots": ["source_versioning", "static_secrets"],
      "provides": ["host_configuration_contract", "idempotence_receipt_requirement"]
    },
    {
      "id": "nix-worker-environment",
      "slot": "worker_environment",
      "interface_version": "zaibatsu.module.v1",
      "kind": "deterministic",
      "implementation_status": "planned",
      "side_effect_authority": false,
      "policy_value": "nix",
      "description": "Reserve a content-addressed Nix boundary for worker tools",
      "rebuild_boundary": "worker_toolchain",
      "requires_slots": ["source_versioning"],
      "provides": ["worker_environment_contract", "cross_node_proof_requirement"]
    },
    {
      "id": "systemd-scheduler",
      "slot": "scheduling",
      "interface_version": "zaibatsu.module.v1",
      "kind": "deterministic",
      "implementation_status": "contract_only",
      "side_effect_authority": false,
      "policy_value": "systemd",
      "description": "Describe one durable systemd scheduler of record",
      "rebuild_boundary": "schedule_and_supervision",
      "requires_slots": ["host_reproduction"],
      "provides": ["scheduler_contract", "duplicate_scheduler_denial"]
    },
    {
      "id": "cron-scheduler",
      "slot": "scheduling",
      "interface_version": "zaibatsu.module.v1",
      "kind": "deterministic",
      "implementation_status": "contract_only",
      "side_effect_authority": false,
      "policy_value": "cron",
      "description": "Describe one bounded cron scheduler of record",
      "rebuild_boundary": "schedule",
      "requires_slots": ["host_reproduction"],
      "provides": ["scheduler_contract", "duplicate_scheduler_denial"]
    },
    {
      "id": "typed-agent-execution",
      "slot": "execution",
      "interface_version": "zaibatsu.module.v1",
      "kind": "probabilistic_adapter",
      "implementation_status": "source_only",
      "side_effect_authority": false,
      "policy_value": "model_independent_typed_ports",
      "description": "Bind deterministic or model workers behind typed task and artifact ports",
      "rebuild_boundary": "worker_contract",
      "requires_slots": ["runtime_secrets", "worker_environment", "scheduling"],
      "provides": ["typed_task", "candidate_artifact", "execution_receipt"]
    },
    {
      "id": "deterministic-verification",
      "slot": "verification",
      "interface_version": "zaibatsu.module.v1",
      "kind": "deterministic",
      "implementation_status": "contract_only",
      "side_effect_authority": false,
      "policy_value": ["schemas", "linters", "tests", "hashes", "policy", "receipts", "owner_approval"],
      "description": "Apply schemas, linters, tests, hashes, policy, receipts, and owner gates",
      "rebuild_boundary": "artifact_acceptance",
      "requires_slots": ["execution"],
      "provides": ["verification_result", "policy_decision", "effect_eligibility"]
    },
    {
      "id": "owner-gated-feedback",
      "slot": "feedback",
      "interface_version": "zaibatsu.module.v1",
      "kind": "deterministic",
      "implementation_status": "contract_only",
      "side_effect_authority": false,
      "policy_value": "reviewed_deterministic_policy_and_owner_gate",
      "description": "Return evidence and propose shared improvements without self-promotion",
      "rebuild_boundary": "reviewed_improvement",
      "requires_slots": ["verification"],
      "provides": ["retained_evidence", "improvement_candidate", "promotion_requirement"]
    }
  ]
}
